{
  "schemaVersion": "1.0",
  "journeyId": "ACCOUNT_OPENING",
  "domainId": "CUSTOMER",
  "version": 1,
  "repositories": [
    { "alias": "API_REPO", "role": "API", "ref": "0123456789012345678901234567890123456789" },
    { "alias": "WEB_REPO", "role": "WEB", "ref": "0123456789012345678901234567890123456789" },
    { "alias": "IOS_REPO", "role": "IOS", "ref": "0123456789012345678901234567890123456789" },
    { "alias": "ANDROID_REPO", "role": "ANDROID", "ref": "0123456789012345678901234567890123456789" }
  ],
  "screens": [{ "screenId": "OPEN_ACCOUNT", "client": "WEB", "repositoryAlias": "WEB_REPO" }],
  "httpEdges": [{
    "edgeId": "EDGE_1", "caller": "WEB_REPO", "apiRepositoryAlias": "API_REPO", "method": "POST",
    "normalizedPath": "/accounts", "requestSchemaRef": "schema/request", "responseSchemaRef": "schema/response",
    "commonHeaderRule": "X-Company-Context", "authenticationClass": "OAUTH", "compatibility": "ADDITIVE_WITH_FLAG",
    "provenance": { "source": "CODE_SCAN", "ref": "0123456789012345678901234567890123456789", "evidenceId": "EVIDENCE_1" }
  }],
  "releasePolicy": { "webApiFirst": true, "nativeReleaseTrain": "MONTHLY_NATIVE", "compatibilityWindowDays": 60, "rollbackRule": "disable AWS toggle" },
  "featureFlag": { "required": true, "provider": "AWS_APP_CONFIG", "ownerRole": "PRODUCT_OWNER" },
  "e2eOwners": [{ "scenario": "HAPPY_PATH", "ownerRole": "QA" }]
}
